<?xml version="1.0" encoding="UTF-8"?>
<!DOCTYPE Reyes SYSTEM "Reyes.dtd">
<Reyes nombreOficial="Reino de Pamplona o Navarra">
	<regente genero="rey" dinastia="Arista" finReinado="851">
		<nombreCompleto>Íñigo Arista</nombreCompleto>
		<apodo>El vascón</apodo>
		<curiosidad>Participó en la batalla de Roncesvalles</curiosidad>
		<nacimiento>790, Condado de Bigorra</nacimiento>
		<Aragon/>
	</regente>
	<regente genero="rey" dinastia="Arista" inicioReinado="851" finReinado="882">
		<nombreCompleto>Garcá Íñiguez</nombreCompleto>
		<apodo>El pamplonés</apodo>
		<curiosidad>Fue prisionero de los vikingos</curiosidad>
		<nacimiento>810, Pamplona</nacimiento>
		<Aragon/>
	</regente>
	<regente genero="rey" dinastia="Arista" inicioReinado="882" finReinado="905">
		<nombreCompleto>Fortún Garcés</nombreCompleto>
		<apodo>El monje</apodo>
		<curiosidad>Fue destronado y recluido al monasterio de Leyre</curiosidad>	
		<curiosidad>Estuvo cautivo en Córdoba</curiosidad>
		<curiosidad>Su hija se convirtión en la abueda de Abderramán III</curiosidad>
		<nacimiento>825, Pamplona</nacimiento>
		<Aragon/>
	</regente>
	<pretendiente genero="reina" dinastia="Arista">
		<nombreCompleto>Toda Aznarez</nombreCompleto>
		<pretension>Fue nombrada la heredera de su abuelo para que su marido (Sancho Garcés) ascendiera al trono</pretension>
		<curiosidad>Se consiguió que su sobrino, Abderramán III, no atacase Navarra y, posteriormente, devolviese a su nieto al trono de León</curiosidad>
		<nacimiento>2-1-876, Castillo de Larraun</nacimiento>
	</pretendiente>
	
	<regente genero="rey" dinastia="Jimena" inicioReinado="905" finReinado="925">
		<nombreCompleto>Sancho Garcés I</nombreCompleto>
		<apodo>El Primer Rey</apodo>
		<curiosidad>Murión al salir a galope su caballo, y su sepultura se estableción en San Esteban, de Deyo (Monjardín) o de Resa, pues recientemente se ha abierto el debate.</curiosidad>	
		<nacimiento>887, Rocaforte</nacimiento>
		<LaRioja/>
	</regente>
	<regente genero="rey" dinastia="Jimena" inicioReinado="925" finReinado="970">
		<nombreCompleto>García Sanchez I</nombreCompleto>
		<apodo>El de la batalla de Simancas</apodo>
		<curiosidad>Acendió al trono con 6 años, por lo que, hasta los 15 hubo regencias de su tío y su madre</curiosidad>	
		<nacimiento>919, Pamplona</nacimiento>
		<LaRioja/>
		<Aragon/>
	</regente>
	<regente genero="rey" dinastia="Jimena" inicioReinado="970" finReinado="994">
		<nombreCompleto>Sancho garcés II</nombreCompleto>
		<apodo>Abarca</apodo>
		<curiosidad>Realizó una visita pacífica a Almanzor, en Córdoba, donde conoció a su nieto Abderramán "Sanchuelo"</curiosidad>	
		<nacimiento>938, Pamplona</nacimiento>
		<LaRioja/>
		<Aragon/>
	</regente>
	<regente genero="rey" dinastia="Jimena" inicioReinado="994" finReinado="1000">
		<nombreCompleto>García Sanchez II</nombreCompleto>
		<apodo>El Temblón</apodo>
		<curiosidad>Tras su muerte no hubo rey por 4 años</curiosidad>	
		<nacimiento>964, Pamplona</nacimiento>
		<LaRioja/>
		<Aragon/>
	</regente>
	<regente genero="rey" dinastia="Jimena" inicioReinado="1004" finReinado="1035">
		<nombreCompleto>Sancho garcés III</nombreCompleto>
		<apodo>El Mayor</apodo>
		<curiosidad>Tras tomar León se proclamó "Imperator Totius Hispaniae"</curiosidad>		
		<curiosidad>Tras su muerte repartió todos sus territorios entre sus hijos, pasando Aragón y Castilla de condados a reinos</curiosidad>	
		<nacimiento>990, Pamplona</nacimiento>
		<LaRioja/>
		<Aragon/>
		<Castilla/>
		<Leon/>
	</regente>
	<regente genero="rey" dinastia="Jimena" inicioReinado="1035" finReinado="1054">
		<nombreCompleto>García Sanchez III</nombreCompleto>
		<apodo>El de Nájera</apodo>
		<curiosidad>Intentó mover la tumba de San Millán a Nájera, pero los bueyes se pararon en seco en donde se construiría el monasterio de San Millán de Yuso</curiosidad>	
		<nacimiento>1012, Nájera</nacimiento>
		<LaRioja/>
		<Castilla/>
	</regente>
	<regente genero="rey" dinastia="Jimena" inicioReinado="1054" finReinado="1076">
		<nombreCompleto>Sancho garcés III</nombreCompleto>
		<apodo>El de Peñalén</apodo>
		<curiosidad>Murió al empujarlo sus hermanos por el barraco de Peñalén</curiosidad>		
		<nacimiento>1039, Nájera</nacimiento>
		<LaRioja/>
	</regente>
</Reyes>